{
  "event_id": "123e4567-e89b-42d3-a456-426614174000",
  "event_name": "specimen_revealed",
  "schema_version": 1,
  "installation_id": "123e4567-e89b-42d3-a456-426614174001",
  "occurred_at": "2026-01-01T00:00:00Z",
  "local_date": "2026-01-01",
  "timezone_offset_minutes": 0,
  "app_version": "1.0.0",
  "version_code": 1,
  "build_channel": "dev",
  "android_api_level": 26,
  "device_class": "phone",
  "locale": "en",
  "consent_scope_version": 1,
  "properties": {}
}
