{
  "event_id": "00000000-0000-4000-8000-000000000045",
  "event_name": "entitlements_restored",
  "schema_version": 1,
  "installation_id": "00000000-0000-4000-8000-000000000001",
  "occurred_at": "2026-01-01T00:00:00Z",
  "local_date": "2026-01-01",
  "timezone_offset_minutes": 0,
  "app_version": "1.0.0",
  "version_code": 1,
  "build_channel": "dev",
  "android_api_level": 26,
  "device_class": "phone",
  "locale": "en",
  "consent_scope_version": 1,
  "properties": {}
}
