{
  "event_id": "00000000-0000-4000-8000-000000000005",
  "schema_version": 1,
  "installation_id": "11111111-1111-4111-8111-111111111111",
  "session_id": "22222222-2222-4222-8222-222222222222",
  "occurred_at": "2026-10-02T12:34:56Z",
  "local_date": "2026-10-02",
  "timezone_offset_minutes": 0,
  "app_version": "0.1.0-dev",
  "version_code": 1000,
  "build_channel": "dev",
  "android_api_level": 36,
  "device_class": "phone",
  "locale": "en-US",
  "consent_scope_version": 1,
  "event_name": "app_backgrounded",
  "screen_name": "today",
  "properties": {
    "duration_seconds": 42
  }
}
